{
  "name": "Light Pastel",
  "colors": {
    "mode": "light",
    "border": {
      "weak": "rgba(200, 200, 200, 0.12)",
      "medium": "rgba(200, 200, 200, 0.20)",
      "strong": "rgba(200, 200, 200, 0.30)"
    },
    "text": {
      "primary": "rgb(50, 50, 50)",
      "secondary": "rgba(50, 50, 50, 0.7)",
      "disabled": "rgba(50, 50, 50, 0.5)",
      "link": "#7E9CCF",
      "maxContrast": "#000000"
    },
    "primary": {
      "main": "#A8DADC",
      "text": "#457B9D",
      "border": "#A8DADC",
      "name": "primary",
      "shade": "#93C9C7",
      "transparent": "#A8DADC26",
      "contrastText": "#FFFFFF",
      "borderTransparent": "#A8DADC40"
    },
    "secondary": {
      "main": "#F4A261",
      "shade": "#F2A473",
      "transparent": "#F4A26126",
      "text": "#E76F51",
      "contrastText": "#FFFFFF",
      "border": "#F4A261",
      "name": "secondary",
      "borderTransparent": "#F4A26140"
    },
    "info": {
      "main": "#B0C4DE",
      "text": "#6A8AAF",
      "border": "#B0C4DE",
      "name": "info",
      "shade": "#9BB3D2",
      "transparent": "#B0C4DE26",
      "contrastText": "#FFFFFF",
      "borderTransparent": "#B0C4DE40"
    },
    "error": {
      "main": "#F28B82",
      "text": "#F6685E",
      "name": "error",
      "border": "#F28B82",
      "shade": "#E67A75",
      "transparent": "#F28B8226",
      "contrastText": "#FFFFFF",
      "borderTransparent": "#F28B8240"
    },
    "success": {
      "main": "#81C995",
      "text": "#519657",
      "name": "success",
      "border": "#81C995",
      "shade": "#6EB780",
      "transparent": "#81C99526",
      "contrastText": "#FFFFFF",
      "borderTransparent": "#81C99540"
    },
    "warning": {
      "main": "#FFD166",
      "text": "#EFB950",
      "name": "warning",
      "border": "#FFD166",
      "shade": "#FFC34D",
      "transparent": "#FFD16626",
      "contrastText": "#000000",
      "borderTransparent": "#FFD16640"
    },
    "background": {
      "canvas": "#FFFFFF",
      "primary": "#F8F9FA",
      "secondary": "#E9ECEF"
    },
    "action": {
      "hover": "rgba(200, 200, 200, 0.16)",
      "selected": "rgba(200, 200, 200, 0.12)",
      "selectedBorder": "#FFD166",
      "focus": "rgba(200, 200, 200, 0.16)",
      "hoverOpacity": 0.08,
      "disabledText": "rgba(200, 200, 200, 0.6)",
      "disabledBackground": "rgba(200, 200, 200, 0.04)",
      "disabledOpacity": 0.38
    },
    "gradients": {
      "brandHorizontal": "linear-gradient(270deg, #A8DADC 0%, #F4A261 100%)",
      "brandVertical": "linear-gradient(0.01deg, #A8DADC 0.01%, #F4A261 99.99%)"
    },
    "contrastThreshold": 3,
    "hoverFactor": 0.03,
    "tonalOffset": 0.15
  },
  "spacing": {
    "gridSize": 8
  },
  "shape": {
    "borderRadius": 6
  },
  "typography": {
    "fontFamily": "\"Inter\", \"Helvetica\", \"Arial\", sans-serif",
    "fontFamilyMonospace": "'Roboto Mono', monospace",
    "fontSize": 14,
    "fontWeightLight": 300,
    "fontWeightRegular": 400,
    "fontWeightMedium": 500,
    "fontWeightBold": 500
  }
}
