{
  "name": "G12",
  "colors": {
    "mode": "dark",
    "background": {
      "canvas": "#12161A",
      "primary": "#0B0F12",
      "secondary": "#1C242B"
    },
    "text": {
      "primary": "#FFFFFF",
      "secondary": "#B7C1C8",
      "disabled": "#000FFF",
      "link": "#00ff41",
      "maxContrast": "#00ff41"
    },
    "border": {
      "weak": "#1C242B",
      "medium": "#2C363F",
      "strong": "#EF5A27"
    },
    "primary": {
      "main": "#24D3EE"
    },
    "gradients": {
      "brandVertical": "linear-gradient(0deg, #008f11 0%, #00ff41 100%)",
      "brandHorizontal": "linear-gradient(90deg, #008f11 0%, #00ff41 100%)"
    }
  },

  "shape": {
    "borderRadius": 6
  },

  "spacing": {
    "gridSize": 8
  }
}
